city,url,desc
Srinagar,https://www.holidify.com/images/bgImages/SRINAGAR.jpg," Famously known as 'Heaven on Earth, Srinagar is located in the union territory of Jammu & Kashmir, on the banks of river Jhelum. Srinagar is known for the stationary houseboats and gondola-type rowboats- Shikaras on Dal Lake. Adorned with tranquil Dal Lake & Nigeen Lake, Srinagar i... "
Leh,https://www.holidify.com/images/bgImages/LADAKH.jpg," Ladakh is a union territory in the Kashmir region of India. Formerly falling in the state of Jammu & Kashmir, Ladakh was administered a union territory on 31st October 2019. Extending from the Siachen Glacier to the main Great Himalayas, Ladakh is a land like no other. Dominated by dramatic land... "
Gangtok,https://www.holidify.com/images/bgImages/GANGTOK.jpg," Incredibly alluring, pleasantly boisterous and wreathed in clouds - Gangtok, the capital of Sikkim, is one of the most popular hill stations in India. Lying at the height of 1650 m above sea level, the town during its bright sunny days offers spectacular views of Mt. Kanchenjunga. Gangtok is a base ... "
Andaman,https://www.holidify.com/images/bgImages/ANDAMAN-NICOBAR-ISLANDS.jpg," Replete with turquoise blue water beaches and a bit of history, Andaman & Nicobar Islands is a little slice of paradise tucked around 1,400 km away from the east coast of mainland India. Port Blair, the capital of this union territory, has a major airport and seaport connected with the rest of t... "
Manali,https://www.holidify.com/images/bgImages/MANALI.jpg," With spectacular valleys, breathtaking views, snowcapped mountains, and lush forests of oak, deodar, and pine, Manali is a magical hill station at the northern end of Kullu valley in Himachal Pradesh. Gifted to the world by the mighty Himalayas, it is known to be one of the most popular destinations... "
Agra,https://www.holidify.com/images/bgImages/AGRA.jpg," Located on the banks of River Yamuna in Uttar Pradesh, Agra is a popular tourist destination as it is home to one of the 7 wonders of the world, the Taj Mahal. It is a sneak peek into the architectural history and legacy of the Mughal empire with two other UNESCO World Heritage S... "
Alleppey,https://www.holidify.com/images/bgImages/ALLEPPEY.jpg," Officially called Alappuzha, Alleppey is known for its network of canals and lagoons with beautiful backwaters and the houseboats offering overnight stays. Located in the southern part of Kerala, the coastline of Alleppey offers some of the best beaches with water sports during the dry sea... "
Gulmarg,https://www.holidify.com/images/bgImages/GULMARG.jpg," Situated at an altitude of 2730 m above sea level, Gulmarg is a popular skiing destination located in Pir Panjal Range of Union territory of Jammu and Kashmir. Surrounded by snow-covered lofty Himalayas, meadows of flowers, deep ravines, evergreen forested valleys, Gulmarg also has the world's secon... "
Darjeeling,https://www.holidify.com/images/bgImages/DARJEELING.jpg," Darjeeling, the former summer capital of India under the British Raj, has evolved into one of India's most sought-after hill stations. This picturesque hill destination in West Bengal is ideal for a romantic honeymoon. Darjeeling, nestled among acres of tea estates, is 2,050 metres above sea level a... "
Goa,https://www.holidify.com/images/bgImages/GOA.jpg," Lying on the western coast, Goa is India's smallest state and unlike any other, known for its endless beaches, stellar nightlife, eclectic seafood, world-heritage listed architecture. Spread across just 3,702 km, Goa lies in the Konkan region. It is a far cry from the hippie haven or ... "
Udaipur,https://www.holidify.com/images/bgImages/UDAIPUR.jpg," Udaipur, the ""City of Lakes,"" stands as a jewel in the crown of Rajasthan, India. Nestled amidst the Aravalli Range, this city captivates visitors with its regal charm, historic grandeur, and scenic landscapes. Located around stunning water lakes and enveloped by the Aravalli Hills in all direc... "
Jaipur,https://www.holidify.com/images/bgImages/JAIPUR.jpg," Jaipur, the capital city of Rajasthan, stands as a jewel in the crown of the Golden Triangle, alongside Delhi and Agra. This enchanting city, often referred to as the ""Pink City,"" owes its nickname to the terracotta-pink hue that adorns many of its buildings. The Pink City is a testament to the roya... "
Varanasi,https://www.holidify.com/images/bgImages/VARANASI.jpg," World's oldest living city, Varanasi - also known as Kashi (City of Life) and Benaras, is the spiritual capital of India. It is one of Hinduism's seven holy cities. The old city of Varanasi lies along the western banks of the Ganges, spread across a labyrinth of narrow galis. Be&... "
Munnar,https://www.holidify.com/images/bgImages/MUNNAR.jpg," Famous for the tea estates, greenery, winding roads, blanket of mist, and viewpoints, Munnar is a hill station in Kerala, located in the Idukki district. Lying in the Western Ghats at 1600 metres, it is one of the most sought after and visited travel destinations globally, especially popular amongst... "
Lakshadweep,https://www.holidify.com/images/bgImages/LAKSHADWEEP-ISLANDS.jpg," Formerly known as Laccadive Islands, Lakshadweep translates to 'one hundred thousand islands' in Malayalam. Home to a few of the most beautiful and exotic islands and beaches of India, Lakshadweep lies 400km off the southwest coast of the Arabian Sea. The smallest union territory of India has&n... "
Amritsar,https://www.holidify.com/images/bgImages/AMRITSAR.jpg," Amritsar, colloquially known as Ambarsar, is a city steeped in history and spirituality. It stands as a prominent cultural and religious hub in the heart of Punjab, as the second largest city of India. The city is most renowned for the Golden Temple, the holiest shrine in Sikhism. The resplende... "
Coorg,https://www.holidify.com/images/bgImages/COORG.jpg," Located amidst imposing mountains in Karnataka with a perpetually misty landscape, Coorg is a popular coffee producing hill station. It is popular for its beautiful green hills and the streams cutting right through them. It also stands as a popular destination because of its culture and people.... "
Ooty,https://www.holidify.com/images/bgImages/OOTY.jpg," Nestled amidst Nilgiri hills, Ooty, also known as Udagamandalam, is a hill station in Tamil Nadu which serves as a top-rated tourist destination. Once regarded as the summer headquarters of the East India Company, the Queen of the hills is a picturesque getaway. "
Rishikesh,https://www.holidify.com/images/bgImages/RISHIKESH.jpg," Located in the foothills of the Himalayas along the convergence of Ganga and Chandrabhaga River, Rishikesh is a small town in the Dehradun district, located close to Haridwar in Uttarakhand. Rishikesh (also called as Hrishikesh) is known for its adventure activities, ancient temples, popular ca... "
Kodaikanal,https://www.holidify.com/images/bgImages/KODAIKANAL.jpg," Located in the state of Tamil Nadu, Kodaikanal is one of the most famous honeymoon destinations in India. A Lakeside resort town of Tamil Nadu, Kodaikanal has a beautiful climate, mist-covered manicured cliffs and waterfall that come together to create the ideal setting for a perfect getaway. Kodaik... "
Mcleodganj,https://www.holidify.com/images/bgImages/MCLEODGANJ.jpg," Mcleodganj, Himachal Pradesh is one of the most popular tourist destinations for it's tibetan culture, nature treks, greenery, ancient temples & monasteries, and british influence. Located in the Kangra district, it's on the outskirts of Dharamshala.Famous for being home to the Tibetan spir... "
Nainital,https://www.holidify.com/images/bgImages/NAINITAL.jpg," Nainital is a charming hill station located at the foothills of the Kumaon ranges in Uttarakhand. Located close to Dehradun and Delhi, it is the most visited hill station in North India. Nainital is a perfect weekend getaway from Delhi and the nearby places. "
Shimla,https://www.holidify.com/images/bgImages/SHIMLA.jpg," Shimla is the capital of Himachal Pradesh and a popular hill-station among Indian families and honeymooners. Situated at the height of 2200m, it was the summer capital of British India. The hill station still retains its old-world charm with beautiful colonial architecture, pedestrian... "
Delhi,https://www.holidify.com/images/bgImages/DELHI.jpg," The capital of India, Delhi is a cosmopolitan city with a historic old Delhi and the modern New Delhi. From historical monuments to crowded shopping malls, from an extensive network of the modern metro system to Delhi University campus, Dilli has multiple personalities and is considered to be the ci... "
Kolkata,https://www.holidify.com/images/bgImages/KOLKATA.jpg," Kolkata, India's second biggest city, is a perpetually ongoing festival of human existence, concurrently luxurious and squalid, refined and frantic, pointedly futuristic, while beautifully in decay. A vibrant 350-year-old metropolis located on India's Eastern Coast, the capital of West Bengal thrive... "
Mussoorie,https://www.holidify.com/images/bgImages/MUSSOORIE.jpg," Mussoorie is one of the most popular hill stations located at a distance of 290 km from Delhi in the Dehradun district of Uttarakhand. With a backdrop of the Shivalik range of Himalayas and doon valley, Mussoorie, also known as Queen of The Hills, stands at an altitude of 7000 feet above sea level. ... "
Pondicherry,https://www.holidify.com/images/bgImages/PONDICHERRY.jpg," Pondicherry, officially known as Puducherry, and commonly referred to as just Pondy, is one of the seven Union Territories of India which is bounded by the southern state of Tamil Nadu. This former French colony is a perfect amalgamation of the traditional Indian sensibilities an... "
Mumbai,https://www.holidify.com/images/bgImages/MUMBAI.jpg," Mumbai, the capital city of the Indian state of Maharashtra, is a spectacular paradox of chaos and hope, glamour and squalor, modernity and tradition. Famously known as the City of Dreams, Mumbai – formerly known as Bombay - Mumbai is a beautifully blended melting pot of cultures and lifestyles. "
Lonavala,https://www.holidify.com/images/bgImages/LONAVALA.jpg," Situated in the Sahyadri range of the Western Ghats close to Pune and Mumbai, Lonavala is the most visited hill station in Maharashtra and the place to be during monsoons. With lots of waterfalls, lakes and hills around, it is a popular destination for camping, trekking and other... "
Varkala,https://www.holidify.com/images/bgImages/VARKALA.jpg," Varkala is a coastal town in the southern part of Kerala known for the unique 15m high 'Northern Cliff' adjacent to the Arabian Sea. It is popular for its hippie culture, shacks on the cliff serving great seafood and playing global music and the samadhi of Kerala's saint Sree Narayana Guru... "
Dalhousie,https://www.holidify.com/images/bgImages/DALHOUSIE.jpg," Dalhousie is a popular hill station spread out over five hills in Himachal Pradesh boasting views of the snow-capped peaks of the Dhauladhar ranges. Famous for its meadows, dense forests, and waterfalls, it is especially a favourite amongst honeymooners and family vacationers. "
Amarnath,https://www.holidify.com/images/bgImages/AMARNATH.jpg," Amarnath, located in union territory of Jammu and Kashmir is one of the most important pilgrimage in India for the worshippers of Lord Shiva. The Amarnath cave has an enshrined Shivaling formed naturally with ice, which resembles Lord Shiva. "
Mount,https://www.holidify.com/images/bgImages/MOUNT-ABU.jpg," The only hill station of Rajasthan, Mount Abu is located in the Aravali range. The most important attraction, however, are undoubtedly the Dilwara temples, which is one of the most stunning pieces of architecture in the country.  Travellers can enjoy calm and relaxed boating in N... "
Wayanad,https://www.holidify.com/images/bgImages/WAYANAD.jpg," Nestled in the Western Ghats of Kerala, Wayanad in Kerala is famous for its spice plantations and wildlife. Situated at an altitude ranging from 700 to 2100 meters above sea level, this picturesque region is blessed with verdant forests, mist-covered hills, and glistening waterfalls, making it ... "
Pachmarhi,https://www.holidify.com/images/bgImages/PACHMARHI.jpg," Pachmarhi is the only hill station and is the highest point in Madhya Pradesh. Pachmarhi is also often known as ""Satpura ki Rani"" or the ""Queen of the Satpura Range"". Situated at an altitude of 1,067 metres, the picturesque town is a part of UNESCO Biosphere Reserve, home to leopards ... "
Bangalore,https://www.holidify.com/images/bgImages/BANGALORE.jpg," Having evolved gradually from being the Garden city to the Silicon Valley of India, Bangalore is India's third-largest city. Bangalore is loved for its pleasant weather, beautiful parks and the many lakes here. Bangalore is renowned for its eateries, street food corners, quirky cafes, coffee ro... "
Jodhpur,https://www.holidify.com/images/bgImages/JODHPUR.jpg," Jodhpur is the second-largest city in Rajasthan and the former capital of the Marwar region. It is popularly called ""the Blue City"" as it looks completely blue from an aerial view because of its blue walls and houses. Jodhpur is primarily famous for its temples, lakes and snacks, with the ... "
Jaisalmer,https://www.holidify.com/images/bgImages/JAISALMER.jpg," Jaisalmer, a mesmerizing destination nestled in the heart of the Thar Desert, is a jewel in the crown of Rajasthan. Often referred to as the ""Golden City,"" Jaisalmer captivates visitors with its sandstone architecture, picturesque landscapes, and rich cultural heritage. The city is adorned with... "
Ujjain,https://www.holidify.com/images/bgImages/UJJAIN.jpg," Ujjain, considered to be one of the holiest cities of India, is an ancient city situated on the eastern bank of the Shipra River in the Malwa region of Madhya Pradesh. Ujjain is one of the four sites for the Kumbh Mela, the largest peace-time gathering on the planet that attracts 100 million people ... "
Hyderabad,https://www.holidify.com/images/bgImages/HYDERABAD.jpg," A city of contrasts, Hyderabad exudes an old-world charm of its own with the Old City (Charminar side), Hitech City (Cyberabad) and the other areas lying between the old and the new. The capital and the largest city of Telanaga, Hyderabad is home to stately mosques and noisy bazaars lined ... "
Khajuraho,https://www.holidify.com/images/bgImages/KHAJURAHO.jpg," Khajuraho, a UNESCO World Heritage Site located in Madhya Pradesh, is known around the world for its stunning temples adorned by erotic and sensuous carvings. A small town located in the Bundelkhand region, Khajuraho is a brilliant example of Indian architecture and its culture back in the medi... "
Chennai,https://www.holidify.com/images/bgImages/CHENNAI.jpg," Formerly known as Madras, Chennai is the capital city of the state of Tamil Nadu, in the southern part of India. Located on the Coromandel coast of Bay of Bengal, Chennai is as dynamic as it is immersed in tradition. This 'capital of the south', is one among the four metropolitan siblings of In... "
Vaishno,https://www.holidify.com/images/bgImages/VAISHNO-DEVI.jpg," Vaishno Devi is a temple town that's home to the famous Vaishno Devi Mandir. Located in Trikuta hills, 13 kms from Katra (in the union territory of Jammu and Kashmir); this renowned shrine allures millions of devotees from all over the world.  Popularly known as Mata Rani, Vaishnavi and Tr... "
Ajanta,https://www.holidify.com/images/bgImages/AJANTA-AND-ELLORA-CAVES.jpg," Ajanta and Ellora caves, considered to be one of the finest examples of ancient rock-cut caves, are located near Aurangabad in Maharashtra, India. Ajanta and Ellora caves complex is adorned with beautiful sculptures, paintings, and frescoes and include Buddhist monasteries, Hindu and Jain temples. T... "
Haridwar,https://www.holidify.com/images/bgImages/HARIDWAR.jpg," Haridwar is one of the seven holiest cities in India, situated in Uttarakhand. It is located where the sacred river Ganga enters the Indo-Gangetic plains for the first time. Dotted with temples, ashrams and narrow lanes across the city, Haridwar is a famous Hindu temple town where millions of d... "
Kanyakumari,https://www.holidify.com/images/bgImages/KANYAKUMARI.jpg," Bordered by the three seas - Arabian, Indian and the Bay of Bengal, Kanyakumari is the southernmost tip of the Indian Peninsula. A small coastal town in the state of Tamil Nadu, Kanyakumari was earlier known as Cape Comorin.  "
Hampi,https://www.holidify.com/images/bgImages/HAMPI.jpg," Hampi, the city of ruins, is a UNESCO World Heritage Site. Situated in the shadowed depth of hills and valleys in the state of Karnataka, this place is a historical delight for travellers. Surrounded by 500 ancient monuments, beautiful temples, bustling street markets, bastions, treasury building an... "
Kochi,https://www.holidify.com/images/bgImages/KOCHI.jpg," Lying on the Malabar coast in the southwest of India, Kochi or Cochin is a port city with a trading history that dates back to at least 600 years. Known popularly as the Queen of the Arabian Sea, the city is also Kerala's financial, commercial, and industrial capital. Exuding an old-world charm with... "
Tirupati,https://www.holidify.com/images/bgImages/TIRUPATI.jpg," Situated in the Chittoor district of Andhra Pradesh, Tirupati is known for Lord Venkateshwara Temple, one of the most visited pilgrimage centers in the world. It is also one of the world's richest temples known by different names - Tirumala Temple, Tirupati Temple, and Tirupati Balaji Temple. Tiruma... "
Alibaug,https://www.holidify.com/images/bgImages/ALIBAG.jpg," Alibaug (also spelled as Alibag) is a small coastal town in the Konkan region of Maharashtra, known for its beaches, villas, and beautiful scenery. Alibag is very popular as a weekend getaway from the cities of Mumbai and Pune.  "
Ahmedabad,https://www.holidify.com/images/bgImages/AHMEDABAD.jpg," A rapidly growing metropolis, an industrial hub, an educational hotspot, and a city with a magnificent past – Ahmedabad is one of the most important cities in Gujarat. Located on the banks of the Sabarmati River, Ahmedabad is the former capital of Gujarat, and its delicious food, colourful culture i... "
Kanha,https://www.holidify.com/images/bgImages/KANHA-NATIONAL-PARK.jpg," Located in a central region of Madhya Pradesh, Kanha National Park is the largest National Park in central India and has been ranked as one of the best parks in Asia. Among the 22 species of large mammals, the royal Bengal tigers are one of the major attractions. One of the best tiger reserves in In... "
Kasol,https://www.holidify.com/images/bgImages/KASOL.jpg," Kasol is a quaint little village in Himachal situated along the banks of the river Parvati. Commonly known as the 'Amsterdam of India', Kasol is a tourist attraction that is rapidly gaining fame as a popular hub for trekkers, backpackers, and nature lovers. The valley is situated 23 kms from Bh... "
Mysore,https://www.holidify.com/images/bgImages/MYSORE.jpg," Famously known as The City of Palaces, it wouldn’t be wrong to say that Mysore, currently Mysuru, is one of the most important places in the country regarding ancient reigns. It is replete with the history of its dazzling royal heritage, intricate architecture, its famed silk sarees, yoga, and ... "
Almora,https://www.holidify.com/images/bgImages/ALMORA.jpg," Set in the background of snow-capped Himalayan ranges of Uttarakhand, the sprawling town of Almora is a beautiful hill station. With easy accessibility from Delhi and other major cities of North India, Almora is known for its rich cultural heritage, unique handicrafts, sumptuous cuisine and magnific... "
Shirdi,https://www.holidify.com/images/bgImages/SHIRDI.jpg," Located at a distance of 122 Km from Nasik in the Ahmednagar district of Maharashtra, Shirdi is the home of Sai Baba. It is believed that Sai Baba arrived at Shirdi in 1858 and spent 60 years of his life here until he attained salvation in 1918. Sai Baba is popularly known as the 'child of God', as ... "
Madurai,https://www.holidify.com/images/bgImages/MADURAI.jpg," Madurai, the cultural capital of Tamil Nadu, is one of the oldest continuously inhabited cities of India. Ruled by Pandya kings for the longest time in its history, it is called as the 'Lotus City' as it was planned and built in the shape of a lotus. Madurai is known for Meenakshi Amm... "
Bodh,https://www.holidify.com/images/bgImages/BODH-GAYA.jpg," Bodh Gaya is a Buddhist pilgrimage site in Gaya District of Bihar. Famous for the Mahabodhi Temple, It was here under the Bodhi tree that Gautama Buddha attained enlightenment. "
Auli,https://www.holidify.com/images/bgImages/AULI.jpg," Dotted with the apple orchards, old oaks, and pine trees there is no dearth of natural beauty in Auli. Apart from skiing you can also go for numerous treks in the hills of Garhwal Himalayas and enjoy the spellbinding views of the snow-draped mountains. Auli is a popular hill resort in the Himalayan ... "
Mahabaleshwar,https://www.holidify.com/images/bgImages/MAHABALESHWAR.jpg," Mahabaleshwar is a hill station located in the Western Ghats, in Satara district of Maharashtra. Apart from its strawberries, Mahabaleshwar is also well known for its numerous rivers, magnificent cascades and majestic peaks. It is among the most sought after weekend getaways from Pune & Mum... "
Kaziranga,https://www.holidify.com/images/bgImages/KAZIRANGA-NATIONAL-PARK.jpg," Home to the largest population of the one-horned rhino on earth, Kaziranga National Park is one of India’s national treasures in terms of flora and fauna. Located in the state of Assam in North-Eastern India, its total area is shared by the districts of Nagaon, Golaghat and Karbi Anglong placing it ... "
Jim,https://www.holidify.com/images/bgImages/CORBETT-NATIONAL-PARK.jpg," Jim Corbett National Park is the oldest national park set amidst the foothills of the Himalayas in the Nainital district of Uttarakhand. Known for housing the endangered Bengal tiger, Corbett National Park is part of the larger Corbett Tiger Reserve. "
Nashik,https://www.holidify.com/images/bgImages/NASIK.jpg," Nasik is a religious Hindu city, host to the Kumbh Mela every 12 years. It also makes for a perfect wine tasting destination. "
Chandigarh,https://www.holidify.com/images/bgImages/CHANDIGARH.jpg," Chandigarh is a union territory that is the capital of both Punjab, as well as, Haryana. India's first planned city, Chandigarh is traditionally a Punjabi city at heart with a healthy dose of modernity; Chandigarh's food and gedi culture (a leisure drive or ride the city) is what the capit... "
Mathura,https://www.holidify.com/images/bgImages/MATHURA.jpg," One of Hinduism's seven sacred cities, Mathura is the birthplace of the very beloved Lord Krishna. Located in the state of Uttar Pradesh, Mathura and Vrindavan are often considered twin cities (located only 10km away from each other). Mathura is a small town dotted with temples from various ages and... "
Jog,https://www.holidify.com/images/bgImages/JOG-FALLS.jpg," The second-highest plunge waterfall in India, Jog Falls is a major tourist attraction in Karnataka and is the highest waterfall in the state. Second, to the Nohkalikai Falls of Meghalaya, Jog falls drops about a huge 253 m (850 ft. ) in a single fall. However, due to the construc... "
Shimoga,https://www.holidify.com/images/bgImages/SHIMOGA.jpg," With nature in its full bloom, the town of Shimoga has been home to several great dynasties and kingdoms. Packed with several marvels of nature in the form of picturesque landscape, gorgeous waterfalls, mystical temples and lush green surroundings, its raw beauty will leave you absolutely enchanted.... "
Rameshwaram,https://www.holidify.com/images/bgImages/RAMESWARAM.jpg," Rameshwaram is located on a beautiful island in the South Indian state of Tamil Nadu. It is separated by a small Pamban channel from Sri Lanka. According to Hindu mythology, this is the place where Lord Rama created a bridge across the sea to Sri Lanka. "
Visakhapatnam,https://www.holidify.com/images/bgImages/VISAKHAPATNAM.jpg," Visakhapatnam, also commonly known as Vizag, is one of the oldest port cities in the country. Situated in the heart of Andhra Pradesh, Vizag was announced as the state capital of Andhra Pradesh on January 31, 2023. The city is known for its picturesque beaches and serene landscape, as well as a... "
Pune,https://www.holidify.com/images/bgImages/PUNE.jpg," Pune is a bustling metropolis of Maharashtra, ranked number one in India in the ease of living. Often referred to as the Oxford of the East, it is a hub of diverse people and activities and is in rapidly growing into one of the top metropolitan cities in the country. Pune is a city that pe... "
Vrindavan,https://www.holidify.com/images/bgImages/VRINDAVAN.jpg," One of the oldest cities on the banks of Yamuna, Vrindavan is considered to be one of the most important places of pilgrimage for the devotees of Krishna. It is said that Lord Krishna had spent his childhood in Vrindavan. The name of the city has been derived from Vrinda (meaning basil) and van (mea... "
Ranthambore,https://www.holidify.com/images/bgImages/RANTHAMBORE.jpg," This is one of the best tiger reserves of the country, known to have ""friendly"" tigers and chances of sighting one here is reasonably better than many other tiger reserves of India. Along with this Ranthambore has one of the richest flora and fauna making it an absolutely must visit area "
